ELEMENT_GLOBAL_ID,GLOBAL_UNIQUE_IDENTIFIER,ELEMENT_NATIONAL_ID,ELEMENT_CODE,CATEGORY,TAX_GROUP,GLOBAL_SCIENTIFIC_NAME,CLASSIFICATION_STATUS,GNAME_LEVEL,CONCEPT_REF_CODE,CONCEPT_REF_FULL,TAX_COM,GLOBAL_ENGL_NAME,GLOB_FR_NAME,GLOBAL_SYNONYMS,CA_NNAME_LEVEL,NATIONAL_SCIENTIFIC_NAME,NATIONAL_ENGL_NAME,NATIONAL_FR_NAME,NATIONAL_SYNONYMS,G_RANK,ROUNDED_G_RANK,G_RANK_CHANGE_DATE,G_RANK_REVIEW_DATE,N_RANK,ROUNDED_N_RANK,N_RANK_CHANGE_DATE,N_RANK_REVIEW_DATE,BCD_STYLE_N_RANK,SARA_STATUS,SARA_DATE,COSEWIC_ID,COSEWIC_DESC,COSEWIC_DATE,COSEWIC_SUMMARY,COSEWIC_NAME,GRANK_REASONS,CURRENT_CA_DISTRIBUTION,CURRENT_US_DISTRIBUTION
160391,2-160391,213784,PDFAB250P0,Vascular Plant,Dicots,Lathyrus palustris,Standard,Species,B94KAR01HQUS,"Kartesz, J.T. 1994. A synonymized checklist of the vascular flora of the United States, Canada, and Greenland. 2nd edition. 2 vols. Timber Press, Portland, OR.",,Vetchling Peavine,Gesse des marais,,Species,Lathyrus palustris,Marsh Vetchling,Gesse des marais,,G5,G5,6/6/1984,5/13/2016,N5,N5,4/15/2014,11/3/2017,,,,,,,,,,"AB(S1), BC(S4S5), LB(S2S4), MB(S5), NB(S5), NF(S4), NS(S5), NU(SU), ON(S5), PE(S5), QC(S5), SK(S5?)","AK(SNR), AL(S1), CA(S2), CT(SNR), DC(SH), DE(SH), GA(S1?), IA(S4), ID(SNR), IL(SNR), IN(SNR), KY(S2), MA(SNR), MD(S1), ME(SNR), MI(SNR), MN(SNR), MO(SNR), NC(S1), ND(SNR), NE(S1S3), NH(SNR), NJ(S2), NY(S4), OH(SNR), OR(SNR), PA(S1), RI(SNR), SD(SNR), TN(S1), TV(SNR), VA(S1), VT(S2), WA(SNR), WI(SNR), WV(S1)"
144086,2-144086,213136,PDFAB25160,Vascular Plant,Dicots,Lathyrus venosus,Standard,Species,B94KAR01HQUS,"Kartesz, J.T. 1994. A synonymized checklist of the vascular flora of the United States, Canada, and Greenland. 2nd edition. 2 vols. Timber Press, Portland, OR.",Kartesz (1999) treats this species without recognition of subspecies or varieties; several infraspecific taxa are recognized in some works. LEM 24Sep01.,Smooth Veiny Peavine,Gesse veinée,,Species,Lathyrus venosus,Veiny Vetchling,Gesse veinée,,G5,G5,10/11/1985,5/13/2016,N5,N5,4/15/2014,11/3/2017,,,,,,,,,,"AB(S4), MB(S5), ON(S4), QC(SH), SK(S4)","AK(SNR), AL(S1), AR(SNR), DC(S1), GA(S3?), GS(PNR), IA(S4), IL(SNR), IN(S1), KY(S2S3), LA(S4), MD(S4), MI(SNR), MN(SNR), MO(SU), NC(S3), ND(SNR), NJ(SX), NM(SNR), NY(S1), OH(S1), OK(SNR), PA(S2), SD(SNR), TN(SNR), TV(SNR), TX(SNR), VA(S4), WI(SNR), WV(S4)"
145159,2-145159,246706,PDFAB25163,Vascular Plant,Dicots,Lathyrus venosus var. intonsus,Nonstandard,Variety,UNDABI02HQUS,NatureServe. Unpublished. Concept reference for taxa for which no reference which describes the circumscription has been recorded; to be used as a placeholder until such a citation is identified.,Kartesz (1999) treats this species without recognition of subspecies or varieties; several infraspecific taxa are recognized in some works. LEM 24Sep01.,Veiny Pea,,,Variety,Lathyrus venosus var. intonsus,Veiny Vetchling,Gesse veinée,,G5T5,T5,8/7/1991,8/7/1991,N5,N5,10/11/2019,10/11/2019,,,,,,,,,"Common and moderately widespread (but questionably distinct) variety of common species in northern (primarily eastern) North America, with thousands of occurrences.","ON(S4), QC(SNR)","AK(S1), GS(P3), IL(SNR), MN(SNR)"
160584,2-160584,222512,PDBRA1N012,Vascular Plant,Dicots,Lesquerella alpina var. spathulata,Standard,Variety,B99KAR01HQUS,"Kartesz, J.T. 1999. A synonymized checklist and atlas with biological attributes for the vascular flora of the United States, Canada, and Greenland. First edition. In: Kartesz, J.T., and C.A. Meacham. Synthesis of the North American Flora, Version 1.0. North Carolina Botanical Garden, Chapel Hill, N.C.",This Kartesz (1999) concept is broader than the concept of Physaria spatulata in Flora of North America Editorial Committtee (2010). Kartesz (1999) included Lesquerella spathulata and Lesquerella curvipes in Lesquerella alpina var. spathulata. Flora of North America Editorial Committtee (2010) treats Physaria spatulata and Physaria curvipes as distinct species.,Spatulate Bladderpod,Lesquerelle spatulée,"Physaria reediana ssp. spatulata, Physaria spatulata",Variety,Lesquerella alpina var. spathulata,Spatulate Bladderpod,Lesquerelle spatulée,"Physaria reediana ssp. spatulata, Physaria spatulata",G5TNR,TNR,9/24/2001,,NNR,NNR,11/18/2019,11/18/2019,NSYN,,,,,,,,,"AB(SNR), SK(SNR)","ID(SNR), KS(S1), MT(SNR), SD(SNR), WY(SNR)"
151098,2-151098,225923,PMPOA6P060,Vascular Plant,Monocots,Leymus cinereus,Standard,Species,B94KAR01HQUS,"Kartesz, J.T. 1994. A synonymized checklist of the vascular flora of the United States, Canada, and Greenland. 2nd edition. 2 vols. Timber Press, Portland, OR.",,Great Basin Wildrye,Élyme cendré,"Elymus cinereus, Elymus piperi",Species,Leymus cinereus,Great Basin Lymegrass,Élyme cendré,"Elymus cinereus, Elymus piperi",G5,G5,7/7/1993,7/13/2016,N5,N5,7/13/2016,7/13/2016,,,,,,,,,,"AB(S3), BC(S5), SK(S2)","AZ(SNR), CA(SNR), CO(SNR), ID(SNR), MN(SNR), MT(S4), NE(SH), NM(SNR), NV(SNR), OR(SNR), UT(SNR), WA(SNR), WY(S4S5)"
136529,2-136529,239235,PMPOA6P090,Vascular Plant,Monocots,Leymus innovatus,Standard,Species,B94KAR01HQUS,"Kartesz, J.T. 1994. A synonymized checklist of the vascular flora of the United States, Canada, and Greenland. 2nd edition. 2 vols. Timber Press, Portland, OR.","FNA (vol. 24, 2007) recognizes two subspecies; L. innovatus ssp. innovatus and L. innovatus ssp. velutinus.",Northwestern Wildrye,Élyme innovant,Elymus innovatus,Species,Leymus innovatus,Downy Lymegrass,Élyme innovant,Elymus innovatus,G5,G5,6/25/1991,5/16/2016,N5,N5,1/30/2013,11/3/2017,,,,,,,,,"Abundant, especially under lodgepole pine forests in British Columbia and Alberta.","AB(S5), BC(S5), MB(S5), NT(S5), ON(S4), SK(S4), YT(S5)","AK(SNR), MT(S2), SD(SNR), WY(S2)"
844355,2-844355,844356,PMPOA6P091,Vascular Plant,Monocots,Leymus innovatus ssp. innovatus,Provisional,Subspecies,B07FNA24HQUS,"Flora of North America Editorial Committee. 2007a. Flora of North America North of Mexico. Vol. 24. Magnoliophyta: Commelinidae (in part): Poaceae, part 1. Oxford Univ. Press, New York. xxviii + 911 pp.",,Downy Lymegrass,Élyme innovant,,Subspecies,Leymus innovatus ssp. innovatus,Downy Lymegrass,Élyme innovant,,G5T5,T5,5/5/2015,5/5/2015,N5,N5,1/30/2013,10/16/2019,,,,,,,,,,"BC(S5), MB(S5), NT(SU), ON(S4), SK(S4), YT(SNR)",
946976,2-946976,946977,PMPOA6P092,Vascular Plant,Monocots,Leymus innovatus ssp. velutinus,Provisional,Subspecies,B07FNA24HQUS,"Flora of North America Editorial Committee. 2007a. Flora of North America North of Mexico. Vol. 24. Magnoliophyta: Commelinidae (in part): Poaceae, part 1. Oxford Univ. Press, New York. xxviii + 911 pp.",,Northern Downy Lymegrass,Élyme velouté,,Subspecies,Leymus innovatus ssp. velutinus,Northern Downy Lymegrass,Élyme velouté,,G5TNR,TNR,,,NNR,NNR,,,,,,,,,,,,"NT(SU), YT(SNR)",
160466,2-160466,232804,PMPOA6P030,Vascular Plant,Monocots,Leymus mollis,Standard,Species,B94KAR01HQUS,"Kartesz, J.T. 1994. A synonymized checklist of the vascular flora of the United States, Canada, and Greenland. 2nd edition. 2 vols. Timber Press, Portland, OR.",,American Dunegrass,Élyme des sables d'Amérique,Elymus mollis,Species,Leymus mollis,Sea Lymegrass,Élyme des sables d'Amérique,Elymus mollis,G5,G5,12/14/1989,3/7/2016,N5,N5,5/29/2014,3/7/2016,,,,,,,,,,"AB(S1), BC(S5), LB(S5), MB(S2S3), NB(S5), NF(S5), NS(S5), NT(S4), NU(S4), ON(S4), PE(S4), QC(SNR), SK(S2), YT(S3)","AK(SNR), CA(SNR), MA(S1), ME(SNR), MI(S3), NH(SNR), OR(SNR), PA(SNR), WA(SNR)"
153972,2-153972,215732,PMPOA6P031,Vascular Plant,Monocots,Leymus mollis ssp. mollis,Standard,Subspecies,B94KAR01HQUS,"Kartesz, J.T. 1994. A synonymized checklist of the vascular flora of the United States, Canada, and Greenland. 2nd edition. 2 vols. Timber Press, Portland, OR.",,American Dunegrass,Élyme des sables d'Amérique,"Elymus arenarius var. villosus, Elymus mollis ssp. mollis",Subspecies,Leymus mollis ssp. mollis,Sea Lymegrass,Élyme des sables d'Amérique,"Elymus arenarius var. villosus, Elymus mollis ssp. mollis",G5T5,T5,4/24/1984,3/7/2016,N5,N5,5/29/2014,10/16/2019,,,,,,,,,,"AB(S1), BC(S5), LB(S5), MB(S2S3), NB(S5), NF(S5), NS(S5), NT(SU), NU(SNR), ON(S4), PE(S4), QC(S5), SK(S2), YT(SNA)","AK(SNR), CA(SNR), IL(S1), MA(SNR), ME(SNR), MI(SNR), NH(S1), OR(SNR), PA(SNR), WA(SNR)"
150388,2-150388,239586,PMPOA6P032,Vascular Plant,Monocots,Leymus mollis ssp. villosissimus,Standard,Subspecies,B94KAR01HQUS,"Kartesz, J.T. 1994. A synonymized checklist of the vascular flora of the United States, Canada, and Greenland. 2nd edition. 2 vols. Timber Press, Portland, OR.",,Sea Lyme Grass,Élyme des sables velu,Leymus villosissimus,Subspecies,Leymus mollis ssp. villosissimus,Arctic Lymegrass,Élyme des sables velu,Leymus villosissimus,G5TNR,TNR,3/16/1993,,N4,N4,5/29/2014,5/29/2014,,,,,,,,,,"NT(SU), NU(SNR), YT(S3)",AK(SNR)
138878,2-138878,210305,PMPOA6P0E0,Vascular Plant,Monocots,Leymus triticoides,Standard,Species,B94KAR01HQUS,"Kartesz, J.T. 1994. A synonymized checklist of the vascular flora of the United States, Canada, and Greenland. 2nd edition. 2 vols. Timber Press, Portland, OR.",,Beardless Lyme Grass,Élyme faux-blé,Elymus triticoides,Species,Leymus triticoides,Creeping Lymegrass,Élyme faux-blé,Elymus triticoides,G4G5,G4,11/29/1993,11/29/1993,NNA,NNA,1/28/2015,1/28/2015,NR,,,,,,,,,,"AZ(SNR), CA(SNR), CO(SNR), HI(SNA), ID(SNR), MT(S3), NM(SNR), NV(SNR), OR(SNR), TX(SNR), UT(SNR), WA(SNR), WY(SH)"
146672,2-146672,232322,PMLIL1A050,Vascular Plant,Monocots,Lilium columbianum,Standard,Species,B94KAR01HQUS,"Kartesz, J.T. 1994. A synonymized checklist of the vascular flora of the United States, Canada, and Greenland. 2nd edition. 2 vols. Timber Press, Portland, OR.",,Columbian Lily,Lis du Columbia,,Species,Lilium columbianum,Columbia Lily,Lis du Columbia,,G5,G5,8/12/2015,8/12/2015,N5,N5,4/17/2014,11/3/2017,,,,,,,,,,BC(S5),"CA(SNR), ID(SNR), MT(S2), OR(SNR), WA(SNR)"
148027,2-148027,224285,PDLIN020G0,Vascular Plant,Dicots,Linum lewisii,Standard,Species,B94KAR01HQUS,"Kartesz, J.T. 1994. A synonymized checklist of the vascular flora of the United States, Canada, and Greenland. 2nd edition. 2 vols. Timber Press, Portland, OR.","In Kartesz 1999's treatment of Linum,  he elevates 'var. lewisii', which many place in L. perenne,  to its own species.",Prairie Flax,Lin de Lewis,,Species,Linum lewisii,Wild Blue Flax,Lin de Lewis,,G5,G5,4/21/2009,5/16/2016,N5,N5,9/17/2010,11/3/2017,,,,,,,,,,"AB(S5), BC(S5), MB(S4), NT(SNR), NU(SU), ON(S2S3), ON(S2S3), SK(S5), YT(S4)","AK(SNR), AZ(SNR), CA(SNR), CO(SNR), ID(SNR), IL(SNR), KS(SNR), LA(SNA), MN(SNA), MT(S5), ND(SNR), NE(SNR), NM(SNR), NV(SNR), OH(SNR), OK(SNR), OR(SNR), SD(SNR), TX(SNR), UT(SNR), WA(SNR), WV(S2), WY(S5)"
132159,2-132159,195801,PDLIN020G4,Vascular Plant,Dicots,Linum lewisii var. lewisii,Standard,Variety,B94KAR01HQUS,"Kartesz, J.T. 1994. A synonymized checklist of the vascular flora of the United States, Canada, and Greenland. 2nd edition. 2 vols. Timber Press, Portland, OR.",,Prairie Flax,Lin de Lewis,"Linum lewisii ssp. lewisii, Linum perenne var. lewisii",Subspecies,Linum lewisii ssp. lewisii,Wild Blue Flax,Lin de Lewis,"Linum lewisii var. lewisii, Linum perenne var. lewisii",G5T5,T5,4/21/2009,5/16/2016,N5,N5,9/17/2010,1/11/2018,,,,,,,,,,"AB(SNR), BC(S5), MB(S4), NT(SNR), NU(SNR), SK(S5), YT(S4)","AK(SNR), AR(SNA), AZ(SNR), CA(SNR), CO(SNR), ID(SNR), IL(SNA), KS(S1), MN(SNR), MT(SNR), ND(SNR), NE(S1), NM(SNR), NV(SNR), OH(SNR), OK(SNR), OR(SNR), SD(SNR), TX(SNR), WA(SNR), WI(SNR), WV(S2), WY(S5)"
137067,2-137067,208543,PDLIN020G2,Vascular Plant,Dicots,Linum lewisii var. lepagei,Standard,Variety,B94KAR01HQUS,"Kartesz, J.T. 1994. A synonymized checklist of the vascular flora of the United States, Canada, and Greenland. 2nd edition. 2 vols. Timber Press, Portland, OR.","Originally described as the species Linum lepagei (Boivin 1948), this taxon has subsequently been recognized as a subspecies, variety, and form within two different parent species (L. perenne and L. lewisii): renamed as L. perenne ssp. lepagei by Dutilly, Lepage and Duman (1954) (though not clear from original source if author accepted this combination); L. lewisii f. lepagei by Lepage (1957; Naturaliste canadien 84: 64); L. perenne var. lepagei by Boivin (1966); L. lewisii ssp. lepagei by Mosquin (1971); and L. lewisii var. lepagei by Rogers (1979).  Despite these shifts, its validly as a distinct taxon (at whatever rank) has generally been agreed upon, and it is significantly disjunct from the main range of Linum lewisii. It has not been subjected to a recent taxonomic study (e.g. using molecular techniques).",Lepage's Flax,Lin de Lepage,Linum lewisii ssp. lepagei,Variety,Linum lewisii var. lepagei,Lepage's Flax,Lin de Lepage,Linum lewisii ssp. lepagei,G5T3,T3,8/6/2015,8/6/2015,N3,N3,8/6/2015,8/6/2015,,,,,,,,,"A Hudson and James Bay endemic, known from Bay shorelines in Ontario and Manitoba and from several islands in the Bays (Nunavut). There are not a large number of documented sites, with 9-18 sites known in Ontario, several in Manitoba, and several on the Bay islands (Nunavut). However, the Hudson Bay coast has not been extensively explored botanically, and it is believed likely that other populations will be found. Also, the plant has been observed recently in all three jurisdictions from which it is known. Although influences such as mineral exploitation and global climate change may threaten the Hudson Bay coast in the future, several sites are located within protected areas and the plant currently faces few threats.","MB(S1), NU(SNR), ON(S2S3)",
133200,2-133200,237894,PDLIN020K0,Vascular Plant,Dicots,Linum medium,Standard,Species,B94KAR01HQUS,"Kartesz, J.T. 1994. A synonymized checklist of the vascular flora of the United States, Canada, and Greenland. 2nd edition. 2 vols. Timber Press, Portland, OR.",,Stiff Yellow Flax,Lin intermédiaire,,Species,Linum medium,Stiff Yellow Flax,Lin intermédiaire,,G5,G5,4/10/1985,4/10/1985,N3,N3,9/17/2010,9/21/2017,,,,,,,,,,ON(S3),"AL(SNR), AR(SNR), CT(SNR), DC(SNR), DE(SNR), FL(SNR), GA(SNR), IA(SH), IL(SNR), IN(SNR), KS(SNR), KY(SNR), LA(SNR), MA(SNR), MD(SNR), ME(SNR), MI(SNR), MO(SNR), MS(SNR), NC(S5), NJ(SNR), NY(SNR), OH(SNR), OK(SNR), PA(SNR), RI(SNR), SC(SNR), TN(SNR), TX(SNR), VA(S5), VT(S1), WI(SNR), WV(S4)"
134614,2-134614,218239,PDLIN020K1,Vascular Plant,Dicots,Linum medium var. medium,Standard,Variety,B94KAR01HQUS,"Kartesz, J.T. 1994. A synonymized checklist of the vascular flora of the United States, Canada, and Greenland. 2nd edition. 2 vols. Timber Press, Portland, OR.",,Stiff Yellow Flax,Lin intermédiaire,,Variety,Linum medium var. medium,Stiff Yellow Flax,Lin intermédiaire,,G5T3?,T3,7/3/2018,7/3/2018,N3?,N3,6/9/2009,1/10/2018,,,,,,,,,,ON(S3?),PA(SH)
145914,2-145914,244790,PDLIN020K2,Vascular Plant,Dicots,Linum medium var. texanum,Standard,Variety,B94KAR01HQUS,"Kartesz, J.T. 1994. A synonymized checklist of the vascular flora of the United States, Canada, and Greenland. 2nd edition. 2 vols. Timber Press, Portland, OR.",,Texas Stiff Yellow Flax,Lin du Texas,"Linum curtissii, Linum medium ssp. texanum",Variety,Linum medium var. texanum,Texas Stiff Yellow Flax,Lin du Texas,"Linum curtissii, Linum medium ssp. texanum",G5T5,T5,4/10/1985,6/16/2015,N1,N1,3/22/1989,1/10/2018,,,,,,,,,,ON(S1),"AL(SNR), AR(SNR), CT(SU), DC(SNR), DE(S4), FL(SNR), GA(SNR), IA(SNR), IL(SNR), IN(SNR), KS(S1), KY(S4?), LA(SNR), MA(S1), MD(SNR), ME(SNR), MI(SNR), MO(SNR), MS(SNR), NC(S5), NJ(S4), NY(S2), OH(SNR), OK(SNR), PA(SNR), SC(SNR), TN(SNR), TX(SNR), VA(S5), VT(SNR), WI(SNR), WV(S4)"
146563,2-146563,211743,PDLIN020M0,Vascular Plant,Dicots,Linum perenne,Standard,Species,B94KAR01HQUS,"Kartesz, J.T. 1994. A synonymized checklist of the vascular flora of the United States, Canada, and Greenland. 2nd edition. 2 vols. Timber Press, Portland, OR.","The treatment of Linums that Kartesz 1999 uses places 'var. lewsii' in Linum lewisii.   Many treatments place the native variety 'var. lewisii'  in the Eurasian species L. perenne,  including The Flora of the Great Plains, Intermountain Flora vol. 3 and a Flora of Utah (2004).   L. perenne  excluding 'var lewisii'  is non native in the United States and Canada.  Further, the distinction between L. perenne  and L. lewisii is quite subtle, the former being heterostylic and the latter homostylic.  Welsh et al. 2004 of A Utah Flora say that, 'there is a huge array of variation in this species [L. perenne including 'var' lewisii' , which is a broader treatment than Kartesz 1999, but the comments apply] including petal size and color, plant height, and nature of the leaves, which vary from linear to narrowly lanceolate, small at the stem base, enlarged upward or finally reduced to linear shape upwards'.",Blue Flax,Lin vivace,,Species,Linum perenne,Perennial Flax,Lin vivace,,GNR,GNR,3/22/1994,,NNA,NNA,6/16/2016,6/16/2016,NE,,,,,,,,,"BC(SNA), ON(SNA)","IA(SNA), IL(SNA), KS(SNA), ME(SNA), MI(SNA), NE(SNA), NY(SNA), OH(SNA), PA(SNA), WI(SNA), WV(SNA), WY(SNA)"
128381,2-128381,243087,PDLIN020Q0,Vascular Plant,Dicots,Linum rigidum,Standard,Species,B94KAR01HQUS,"Kartesz, J.T. 1994. A synonymized checklist of the vascular flora of the United States, Canada, and Greenland. 2nd edition. 2 vols. Timber Press, Portland, OR.",,Stiff-stem Flax,Lin rigide,,Species,Linum rigidum,Large-flowered Yellow Flax,Lin rigide,,G5,G5,10/13/2015,10/13/2015,N5,N5,4/18/2014,11/3/2017,,,,,,,,,,"AB(S4), MB(S3S4), SK(S5)","AR(SNR), CO(SNR), IA(S3), IL(SNR), KS(SNR), MN(SNR), MT(S4), ND(SNR), NE(SNR), NM(SNR), OK(SNR), SD(SNR), TX(SNR), WI(SNR), WY(S3)"
131004,2-131004,200293,PDLIN020V0,Vascular Plant,Dicots,Linum sulcatum,Standard,Species,B94KAR01HQUS,"Kartesz, J.T. 1994. A synonymized checklist of the vascular flora of the United States, Canada, and Greenland. 2nd edition. 2 vols. Timber Press, Portland, OR.",,Grooved Yellow Flax,Lin à rameaux sillonnés,,Species,Linum sulcatum,Grooved Yellow Flax,Lin à rameaux sillonnés,,G5,G5,4/10/1985,1/18/2012,N3,N3,12/11/2017,12/11/2017,,,,,,,,,,"MB(S3), ON(S2S3), QC(SNA)","AL(S3S4), AR(SNR), CT(S1), FL(SH), GA(SH), IA(S4), IL(SNR), IN(S3), KS(SNR), KY(S3S4), LA(S1), MA(SNR), MD(S1), MI(S2S3), MN(SNR), MO(SNR), MS(S3), NC(SNR), ND(SNR), NE(SNR), NH(SNR), NJ(SNR), NY(S2), OH(S3), OK(SNR), PA(S1), RI(SH), SD(SNR), TN(SNR), TV(SNR), TX(SNR), VA(S3), VT(SH), WI(SNR), WV(S1)"
146871,2-146871,201619,PDLIN020V2,Vascular Plant,Dicots,Linum sulcatum var. sulcatum,Standard,Variety,B94KAR01HQUS,"Kartesz, J.T. 1994. A synonymized checklist of the vascular flora of the United States, Canada, and Greenland. 2nd edition. 2 vols. Timber Press, Portland, OR.","Weakley (Nov. 2012 draft) treats Linum harperi as a species, distinct from L. sulcatum. Following that treatment L. sulcatum sensu Weakley is the same as L. sulcatum var. sulcatum sensu Kartesz (1994 and 1999) since Kartesz treats L. harperi as a variety of L. sulcatum.",Glade Flax,Lin à rameaux sillonnés,Linum sulcatum,Variety,Linum sulcatum var. sulcatum,Grooved Yellow Flax,Lin à rameaux sillonnés,Linum sulcatum,G5T5,T5,5/31/1993,1/18/2012,NNR,NNR,4/24/2019,4/24/2019,NSYN,,,,,,,,Rank provided by NCHP during data exchange Apr/1994.,"MB(SNR), ON(SNR), QC(SNR)","AL(SNR), AR(SNR), CT(SNR), FL(SNR), GA(SH), IA(SNR), IL(SNR), IN(SNR), KS(SNR), KY(SNR), LA(SNR), MA(SH), MD(SNR), MI(SNR), MN(SNR), MO(SNR), MS(SNR), NC(SH), ND(SNR), NE(SNR), NH(SH), NJ(S1), NY(SNR), OH(SNR), OK(SNR), PA(SNR), RI(SNR), SD(SNR), TN(SNR), TX(SNR), VA(S3), VT(SH), WI(SNR), WV(S1)"
144412,2-144412,195214,PDLIN020Z0,Vascular Plant,Dicots,Linum virginianum,Standard,Species,B94KAR01HQUS,"Kartesz, J.T. 1994. A synonymized checklist of the vascular flora of the United States, Canada, and Greenland. 2nd edition. 2 vols. Timber Press, Portland, OR.",,Virginia Flax,Lin de Virginie,,Species,Linum virginianum,Woodland Flax,Lin de Virginie,,G4G5,G4,6/7/1984,6/7/1984,N2,N2,9/28/1989,9/6/2017,,,,,,,,,,ON(S2),"AL(SNR), CT(SNR), DC(SNR), DE(S4), FL(SNR), GA(SNR), GS(P2P3), IA(SNR), IL(SNR), IN(SNR), KY(S4S5), LA(SNR), MA(SNR), MD(SNR), ME(SNR), MI(S2), MO(SNR), MS(SNR), NC(S3?), NJ(S3), NY(S5), OH(SNR), PA(SNR), RI(SNR), SC(SNR), TN(SNR), TX(SNR), VA(S4S5), WI(SNR), WV(S4)"
154781,2-154781,194526,PDAPI1B010,Vascular Plant,Dicots,Lomatium ambiguum,Standard,Species,B94KAR01HQUS,"Kartesz, J.T. 1994. A synonymized checklist of the vascular flora of the United States, Canada, and Greenland. 2nd edition. 2 vols. Timber Press, Portland, OR.",,Streambank Desert-parsley,Lomatium ambigu,,Species,Lomatium ambiguum,Swale Desert-parsley,Lomatium ambigu,,G4G5,G4,8/31/1988,7/12/2016,N5,N5,11/14/2019,11/14/2019,,,,,,,,,,BC(S5),"ID(SNR), MT(S4), OR(SNR), UT(SNR), WA(SNR), WY(S2)"
143119,2-143119,218001,PDAPI1B0C0,Vascular Plant,Dicots,Lomatium cous,Standard,Species,B94KAR01HQUS,"Kartesz, J.T. 1994. A synonymized checklist of the vascular flora of the United States, Canada, and Greenland. 2nd edition. 2 vols. Timber Press, Portland, OR.",,Cous-root Desert-parsley,Lomatium cahous,,Species,Lomatium cous,Cous-root Desert-parsley,Lomatium cahous,,G5,G5,10/1/1987,10/1/1987,N1N2,N1,8/14/2012,11/3/2017,,,,,,,,,,"AB(S1), SK(S1)","ID(SNR), MT(S5), ND(SNR), NV(SNR), OR(SNR), SD(SNR), UT(S1), WA(SNR), WY(S4)"
133802,2-133802,227730,PDAPI1B0G0,Vascular Plant,Dicots,Lomatium dissectum,Standard,Species,B94KAR01HQUS,"Kartesz, J.T. 1994. A synonymized checklist of the vascular flora of the United States, Canada, and Greenland. 2nd edition. 2 vols. Timber Press, Portland, OR.","A synonym for Lomatium dissectum is Leptotaenia dissecta Nutt.(Torrey and Gray, 1840). Kartesz (1994 and 1999) recognizes two varieties of Lomatium dissectum: variety dissectum and variety multifidum. A third, variety eatonii, has sometimes been recognized as well, but is treated by Kartesz (1999) in his var. multifidum.",Fernleaf Desert-parsley,Lomatium à feuilles découpées,,Species,Lomatium dissectum,Fern-leaved Desert-parsley,Lomatium à feuilles découpées,,G4,G4,7/28/2002,7/22/2016,NNR,NNR,11/19/2019,11/19/2019,NSYN,,,,,,,,"This species (<i>Lomatium dissectum</i>) is widespread, and locally abundant in portions of its range. However, it is mainly wild-harvested to service an increasingly large commercial market for herbal remedies. Although it is possible to cultivate <i>L.</i>","BC(SNR), SK(S1)","AZ(SNR), CA(SNR), CO(SNR), ID(S4), MT(S3S4), NV(SNR), OR(SNR), UT(SNR), WA(SNR), WY(S3S4)"
161608,2-161608,202261,PDAPI1B0G1,Vascular Plant,Dicots,Lomatium dissectum var. dissectum,Standard,Variety,B94KAR01HQUS,"Kartesz, J.T. 1994. A synonymized checklist of the vascular flora of the United States, Canada, and Greenland. 2nd edition. 2 vols. Timber Press, Portland, OR.",,Fernleaf Desert-parsley,Lomatium à feuilles découpées,Lomatium dissectum,Species,Lomatium dissectum,Fern-leaved Desert-parsley,Lomatium à feuilles découpées,Lomatium dissectum var. dissectum,G4T4,T4,1/19/2001,2/28/2003,N2,N2,4/7/2021,4/7/2021,,,,,,,,,"From British Columbia to California along western coastal states and Idaho, in disjunct areas, west of Cascade Range; abundance unknown.",BC(S2),"CA(SNR), ID(S3), OR(SNR), WA(SNR)"
159527,2-159527,205045,PDAPI1B0M0,Vascular Plant,Dicots,Lomatium foeniculaceum,Standard,Species,B94KAR01HQUS,"Kartesz, J.T. 1994. A synonymized checklist of the vascular flora of the United States, Canada, and Greenland. 2nd edition. 2 vols. Timber Press, Portland, OR.",,Carrotleaf Desert-parsley,Lomatium faux-fenouil,,Species,Lomatium foeniculaceum,Fennel-leaved Desert-parsley,Lomatium faux-fenouil,,G5,G5,6/25/1991,5/16/2016,N5,N5,3/13/2012,11/3/2017,,,,,,,,,Abundant in the Great Plains west through the Rocky Mountain states.,"AB(S3), BC(S3), MB(S3), SK(S5)","AZ(SNR), CA(SNR), CO(SNR), IA(S1), ID(SNR), KS(SNR), MO(SNR), MT(SNR), ND(SNR), NE(SNR), NM(SNR), NV(S4), OK(SNR), OR(SNR), SD(SNR), TX(SNR), UT(SNR), WY(S4)"
150080,2-150080,248228,PDAPI1B0M3,Vascular Plant,Dicots,Lomatium foeniculaceum ssp. foeniculaceum,Standard,Subspecies,B94KAR01HQUS,"Kartesz, J.T. 1994. A synonymized checklist of the vascular flora of the United States, Canada, and Greenland. 2nd edition. 2 vols. Timber Press, Portland, OR.",,Carrot-leaf Desert-parsley,Lomatium faux-fenouil,Lomatium foeniculaceum var. foeniculaceum,Variety,Lomatium foeniculaceum var. foeniculaceum,Fennel-leaved Desert-parsley,Lomatium faux-fenouil,Lomatium foeniculaceum ssp. foeniculaceum,G5T5,T5,9/17/1997,5/16/2016,N5,N5,3/13/2012,11/27/2017,,,,,,,,,,"AB(S3), BC(S3), MB(S3), SK(S5)","CO(S2), IA(SNR), KS(SNR), MO(S1S3), MT(SNR), ND(SNR), NE(SNR), OK(SNR), SD(SNR), TX(SNR), WY(S4)"
160214,2-160214,241504,PDAPI1B0N0,Vascular Plant,Dicots,Lomatium geyeri,Standard,Species,B94KAR01HQUS,"Kartesz, J.T. 1994. A synonymized checklist of the vascular flora of the United States, Canada, and Greenland. 2nd edition. 2 vols. Timber Press, Portland, OR.",,Geyer's Desert-parsley,Lomatium de Geyer,,Species,Lomatium geyeri,Geyer's Desert-parsley,Lomatium de Geyer,,G4,G4,7/25/2002,7/22/2016,N5,N5,11/14/2019,11/14/2019,,,,,,,,,,BC(S5),"ID(SNR), MT(S2), WA(SNR)"
135639,2-135639,244388,PDAPI1B120,Vascular Plant,Dicots,Lomatium macrocarpum,Standard,Species,B94KAR01HQUS,"Kartesz, J.T. 1994. A synonymized checklist of the vascular flora of the United States, Canada, and Greenland. 2nd edition. 2 vols. Timber Press, Portland, OR.",,Large-fruit Desert-parsley,Lomatium à gros fruits,,Species,Lomatium macrocarpum,Large-fruited Desert-parsley,Lomatium à gros fruits,,G5,G5,10/1/1987,5/13/2016,N5,N5,2/25/2014,11/4/2017,,,,,,,,,,"AB(S3), BC(S5), MB(S2S3), SK(S5?)","CA(SNR), CO(SNR), ID(SNR), MT(S4S5), ND(SNR), NV(SNR), OR(SNR), SD(SNR), UT(SNR), WA(SNR), WY(S2)"
