ELEMENT_GLOBAL_ID,GLOBAL_UNIQUE_IDENTIFIER,ELEMENT_NATIONAL_ID,ELEMENT_CODE,CATEGORY,TAX_GROUP,GLOBAL_SCIENTIFIC_NAME,CLASSIFICATION_STATUS,GNAME_LEVEL,CONCEPT_REF_CODE,CONCEPT_REF_FULL,TAX_COM,GLOBAL_ENGL_NAME,GLOB_FR_NAME,GLOBAL_SYNONYMS,CA_NNAME_LEVEL,NATIONAL_SCIENTIFIC_NAME,NATIONAL_ENGL_NAME,NATIONAL_FR_NAME,NATIONAL_SYNONYMS,G_RANK,ROUNDED_G_RANK,G_RANK_CHANGE_DATE,G_RANK_REVIEW_DATE,N_RANK,ROUNDED_N_RANK,N_RANK_CHANGE_DATE,N_RANK_REVIEW_DATE,BCD_STYLE_N_RANK,SARA_STATUS,SARA_DATE,COSEWIC_ID,COSEWIC_DESC,COSEWIC_DATE,COSEWIC_SUMMARY,COSEWIC_NAME,GRANK_REASONS,CURRENT_CA_DISTRIBUTION,CURRENT_US_DISTRIBUTION
159253,2-159253,238918,PDROS1C180,Vascular Plant,Dicots,Prunus serotina,Standard,Species,B94KAR01HQUS,"Kartesz, J.T. 1994. A synonymized checklist of the vascular flora of the United States, Canada, and Greenland. 2nd edition. 2 vols. Timber Press, Portland, OR.","Kartesz (1994) here recognizes four distinct varieties (rufula, eximia, serotina, and virens). FNA (vol. 9, 2014) recognizes three varieties in Prunus serotina (alabamensis, rufula, and serotina). FNA includes Prunus alabamensis (= P. serotina var. alabamensis) as a variety of P. serotina, expands the concept of P. serotina var. rufula to include P. serotina var. virens and expands the concept of P. serotina var. serotina to include P. serotina var. eximia, while Kartesz (1994) here treats them as distinct.",Black Cherry,,,Species,Prunus serotina,,,,G5,G5,8/28/1984,5/13/2016,N5,N5,6/8/1999,6/8/1999,NSYN,,,,,,,,,"BC(SNA), NB(SNR), NS(SNR), ON(SNR), QC(SNR)","AL(SNR), AR(SNR), AZ(SNR), CT(SNR), DC(S5), DE(S5), FL(SNR), GA(S5), GS(P5), IA(S5), IL(SNR), IN(SNR), KS(SNR), KY(SNR), LA(SNR), MA(SNR), MD(SNR), ME(SNR), MI(SNR), MN(SNR), MO(SNR), MS(SNR), NC(S5), ND(SNR), NE(SNR), NH(SNR), NJ(SNR), NM(SNR), NY(S5), OH(SNR), OK(SNR), PA(S5), RI(SNR), SC(SNR), TN(SNR), TX(SNR), VA(S5), VT(SNR), WI(SNR), WV(S5)"
961463,2-961463,961466,PDROS1C1T0,Vascular Plant,Dicots,Prunus serotina,Provisional,Species,B14FNA09HQUS,"Flora of North America Editorial Committee. 2014b. Flora of North America North of Mexico. Vol. 9. Magnoliophyta: Picramniaceae to Rosaceae. Oxford University Press, New York. xxiv + 713 pp.","FNA (vol. 9, 2014) here recognizes three varieties in Prunus serotina (alabamensis, rufula, and serotina). FNA includes Prunus alabamensis (= P. serotina var. alabamensis) as a variety of P. serotina, expands the concept of P. serotina var. rufula to include P. serotina var. virens and expands the concept of P. serotina var. serotina to include P. serotina var. eximia, while Kartesz (1994) treats them as distinct.",Black Cherry,Cerisier tardif,,Species,Prunus serotina,Black Cherry,Cerisier tardif,,G5,G5,3/30/2016,3/30/2016,N5,N5,3/30/2016,11/13/2017,,,,,,,,,,"BC(SNA), NB(S5), NS(S5), ON(S5), QC(SNR)","AL(SNR), AR(SNR), AZ(SNR), CT(SNR), DC(SNR), DE(SNR), FL(SNR), GA(SNR), IA(SNR), IL(SNR), IN(SNR), KS(SNR), KY(SNR), LA(SNR), MA(SNR), MD(SNR), ME(SNR), MI(SNR), MN(SNR), MO(SNR), MS(SNR), NC(SNR), NE(SNR), NH(SNR), NJ(SNR), NM(SNR), NY(SNR), OH(SNR), OK(SNR), PA(SNR), RI(SNR), SC(SNR), TN(SNR), TX(SNR), VA(SNR), VT(SNR), WA(SNR), WI(SNR), WV(SNR)"
140867,2-140867,241293,PDROS1C184,Vascular Plant,Dicots,Prunus serotina var. serotina,Standard,Variety,B94KAR01HQUS,"Kartesz, J.T. 1994. A synonymized checklist of the vascular flora of the United States, Canada, and Greenland. 2nd edition. 2 vols. Timber Press, Portland, OR.","FNA (vol. 9, 2014) expands the concept of Prunus serotina var. serotina to include P. serotina var. eximia, while Kartesz (1994) treats them as distinct.",Black Cherry,,,Variety,Prunus serotina var. serotina,,,,G5T5,T5,6/8/1999,5/13/2016,N5,N5,6/8/1999,6/8/1999,NSYN,,,,,,,,,"NB(SNR), NS(SNR), ON(SNR), QC(S3S4)","AL(SNR), AR(SNR), CT(SNR), DC(SNR), DE(S5), FL(SNR), GA(SNR), IA(SNR), IL(SNR), IN(SNR), KS(SNR), KY(SNR), LA(SNR), MA(SNR), MD(SNR), ME(SNR), MI(SNR), MN(SNR), MO(SNR), MS(SNR), NC(S5), ND(SNR), NE(SNR), NH(SNR), NJ(S5), NY(SNR), OH(SNR), OK(SNR), PA(SNR), RI(SNR), SC(SNR), TN(SNR), TX(SNR), VT(SNR), WI(SNR), WV(S5)"
961465,2-961465,961471,PDROS1C1T2,Vascular Plant,Dicots,Prunus serotina var. serotina,Provisional,Variety,B14FNA09HQUS,"Flora of North America Editorial Committee. 2014b. Flora of North America North of Mexico. Vol. 9. Magnoliophyta: Picramniaceae to Rosaceae. Oxford University Press, New York. xxiv + 713 pp.","FNA (vol. 9, 2014) here expands the concept of Prunus serotina var. serotina to include P. serotina var. eximia, while Kartesz (1994) treats them as distinct.",Black Cherry,Cerisier tardif,,Variety,Prunus serotina var. serotina,Black Cherry,Cerisier tardif,,G5T5,T5,3/30/2016,3/30/2016,N5,N5,3/30/2016,3/30/2016,,,,,,,,,,"BC(SNA), NB(S5), NS(S5), ON(S5), QC(SNR)","AL(SNR), AR(SNR), CT(SNR), DC(SNR), DE(SNR), FL(SNR), GA(SNR), IA(SNR), IL(SNR), IN(SNR), KS(SNR), KY(SNR), LA(SNR), MA(SNR), MD(SNR), ME(SNR), MI(SNR), MN(SNR), MO(SNR), MS(SNR), NC(SNR), NE(SNR), NH(SNR), NJ(SNR), NY(SNR), OH(SNR), OK(SNR), PA(SNR), RI(SNR), SC(SNR), TN(SNR), TX(SNR), VA(SNR), VT(SNR), WA(SNR), WI(SNR), WV(SNR)"
136441,2-136441,230357,PDROS1C1E0,Vascular Plant,Dicots,Prunus virginiana,Standard,Species,B94KAR01HQUS,"Kartesz, J.T. 1994. A synonymized checklist of the vascular flora of the United States, Canada, and Greenland. 2nd edition. 2 vols. Timber Press, Portland, OR.",,Choke Cherry,Cerisier de Virginie,,Species,Prunus virginiana,Chokecherry,Cerisier de Virginie,,G5,G5,10/11/1983,3/30/2016,N5,N5,3/30/2016,3/30/2016,,,,,,,,,"Widespread throughout North America except for southeast, locally common (can be monotypic) in open woodlands, prairie hillsides, rocky bluffs, canyons, roadsides, streams, and springs. Intolerant of flooding.","AB(S5), BC(S5), MB(S5), NB(S5), NF(S4), NS(S5), NT(SNR), ON(S5), PE(S5), QC(SNR), SK(S5)","AR(SNR), AZ(SNR), CA(SNR), CO(SNR), CT(SNR), GA(S1), GS(P1), IA(S5), ID(SNR), IL(SNR), IN(SNR), KS(SNR), KY(SNR), MA(SNR), MD(SNR), ME(SNR), MI(SNR), MN(SNR), MO(SNR), MT(S5), NC(S2), ND(SNR), NE(SNR), NH(SNR), NJ(SNR), NM(SNR), NV(SNR), NY(S5), OH(SNR), OK(SNR), OR(SNR), PA(S5), RI(SNR), SD(SNR), TN(S1), TV(SNR), TX(SNR), UT(SNR), VA(S5), VT(SNR), WA(SNR), WI(SNR), WV(S4), WY(S5)"
143394,2-143394,200318,PDROS1C1E1,Vascular Plant,Dicots,Prunus virginiana var. demissa,Standard,Variety,B94KAR01HQUS,"Kartesz, J.T. 1994. A synonymized checklist of the vascular flora of the United States, Canada, and Greenland. 2nd edition. 2 vols. Timber Press, Portland, OR.","FNA (vol. 9, 2014) expands the concept of Prunus virginiana var. demissa to include P. virginiana var. melanocarpa, while Kartesz (1994) here treats them as distinct.",Choke Cherry,,Prunus virginiana ssp. demissa,Variety,Prunus virginiana var. demissa,,,Prunus virginiana ssp. demissa,G5T5,T5,8/2/2002,5/2/2016,NNR,NNR,12/4/2017,12/4/2017,NSYN,,,,,,,,Widespread from southwest to Pacific Northwest on rocky slopes and canyons in numerous habitats; abundance unknown.,"AB(SNR), BC(SNR)","AZ(SNR), CA(SNR), DE(SNR), IA(SNR), ID(SNR), IL(SNR), IN(SNR), NE(SNR), NJ(SNR), NM(SNR), NV(SNR), OR(SNR), TX(SNR), WA(SNR)"
960990,2-960990,960991,PDROS1C1E4,Vascular Plant,Dicots,Prunus virginiana var. demissa,Provisional,Variety,B14FNA09HQUS,"Flora of North America Editorial Committee. 2014b. Flora of North America North of Mexico. Vol. 9. Magnoliophyta: Picramniaceae to Rosaceae. Oxford University Press, New York. xxiv + 713 pp.","FNA (vol. 9, 2014) here expands the concept of Prunus virginiana var. demissa to include P. virginiana var. melanocarpa, while Kartesz (1994) treats them as distinct.",Western Chokecherry,Cerisier du Pacifique,,Variety,Prunus virginiana var. demissa,Western Chokecherry,Cerisier du Pacifique,,G5T5,T5,3/16/2016,5/2/2016,N5,N5,5/2/2016,5/2/2016,,,,,,,,,,"AB(SNR), BC(S5)","AZ(SNR), CA(SNR), CO(SNR), ID(SNR), MT(SNR), NM(SNR), NV(SNR), OR(SNR), TX(SNR), UT(SNR), WA(SNR), WY(SNR)"
129488,2-129488,206363,PDROS1C1E3,Vascular Plant,Dicots,Prunus virginiana var. virginiana,Standard,Variety,B94KAR01HQUS,"Kartesz, J.T. 1994. A synonymized checklist of the vascular flora of the United States, Canada, and Greenland. 2nd edition. 2 vols. Timber Press, Portland, OR.",,Choke Cherry,Cerisier de Virginie,Prunus virginiana ssp. virginiana,Variety,Prunus virginiana var. virginiana,Chokecherry,Cerisier de Virginie,Prunus virginiana ssp. virginiana,G5T5,T5,10/22/2000,3/30/2016,N5,N5,10/22/2000,3/30/2016,,,,,,,,,"<i>Prunus virginiana</i> var. <i>virginana </i> is a successional taxa, found on forested sites in the Great Plains. Individual plants are relatively short lived and decline in vigor and numbers as the forest canopy closes, and are therefore disturbance dependent.","AB(SNR), BC(SNR), MB(S5), NB(S5), NF(S4), NS(S5), NT(SNR), ON(S5), PE(S5), QC(S5?), SK(S5)","CT(SNR), IL(SNR), IN(SNR), KS(SNR), KY(S3S4), MA(SNR), ME(SNR), MO(SNR), NC(S2), ND(SNR), NE(SNR), NH(SNR), NJ(S4), NY(SNR), OH(SNR), RI(SNR), TN(SNR), VT(SNR), WV(S4), WY(SNR)"
134145,2-134145,207496,PMPOA82010,Vascular Plant,Monocots,Pseudoroegneria spicata,Standard,Species,B94KAR01HQUS,"Kartesz, J.T. 1994. A synonymized checklist of the vascular flora of the United States, Canada, and Greenland. 2nd edition. 2 vols. Timber Press, Portland, OR.",,Bluebunch Wheatgrass,Agropyre à épi,"Agropyron spicatum, Elymus spicatus",Species,Pseudoroegneria spicata,Bluebunch Wheatgrass,Agropyre à épi,"Agropyron spicatum, Elymus spicatus",G5,G5,5/25/1994,10/17/2019,N5,N5,10/17/2019,10/17/2019,,,,,,,,,Common and widespread in western US.,"AB(S4), BC(S5), SK(S2), YT(S3S4)","AK(SNR), AZ(SNR), CA(SNR), CO(SNR), ID(SNR), MI(SX), MT(S5), ND(SNR), NE(S1), NM(SNR), NV(SNR), OR(SNR), SD(SNR), TX(SNR), UT(SNR), WA(SNR), WY(S5)"
136725,2-136725,246939,PGPIN05020,Vascular Plant,Conifers,Pseudotsuga menziesii,Standard,Species,B94KAR01HQUS,"Kartesz, J.T. 1994. A synonymized checklist of the vascular flora of the United States, Canada, and Greenland. 2nd edition. 2 vols. Timber Press, Portland, OR.",,Douglas-fir,Douglas de Menzies,,Species,Pseudotsuga menziesii,Douglas-fir,Douglas de Menzies,,G5,G5,8/28/1984,2/4/2016,N5,N5,10/11/2002,2/4/2016,,,,,,,,,,"AB(S5), BC(S5)","AZ(SNR), CA(SNR), CO(SNR), ID(SNR), MN(SNA), MT(S5), NM(SNR), NV(SNR), NY(SNR), OR(S5), PA(SNR), TX(SNR), UT(SNR), WA(SNR), WY(S5)"
145117,2-145117,210730,PGPIN05021,Vascular Plant,Conifers,Pseudotsuga menziesii var. glauca,Standard,Variety,B94KAR01HQUS,"Kartesz, J.T. 1994. A synonymized checklist of the vascular flora of the United States, Canada, and Greenland. 2nd edition. 2 vols. Timber Press, Portland, OR.","Recorded as Pseudotsuga glauca Mayr by Record and Mell, 1924 (B43REC0100LA).",Rocky Mountain Douglas-fir,Douglas bleu,Pseudotsuga glauca,Variety,Pseudotsuga menziesii var. glauca,Rocky Mountain Douglas-fir,Douglas bleu,Pseudotsuga glauca,G5T5,T5,11/15/1996,2/4/2016,N5,N5,11/15/1996,2/4/2016,,,,,,,,,Occurs from latitude 55| north in British Columbia southward at progressively higher elevations throughout the Rocky Mountain system into Mexico as far as Hidalgo. Harvested for timber in large quantities (Record and Hess 1943).,"AB(S5), BC(S5)","AZ(SNR), CO(SNR), ID(SNR), MN(SNR), MT(SNR), NM(SNR), NV(SNR), NY(SNR), OR(SNR), TX(SNR), UT(SNR), WA(SNR), WY(S5)"
130203,2-130203,247740,PGPIN05022,Vascular Plant,Conifers,Pseudotsuga menziesii var. menziesii,Standard,Variety,B94KAR01HQUS,"Kartesz, J.T. 1994. A synonymized checklist of the vascular flora of the United States, Canada, and Greenland. 2nd edition. 2 vols. Timber Press, Portland, OR.",,Douglas-fir,Douglas vert,,Variety,Pseudotsuga menziesii var. menziesii,Coast Douglas-fir,Douglas vert,,G5T5,T5,11/15/1996,2/4/2016,N5,N5,10/11/2002,2/4/2016,,,,,,,,,,BC(S5),"CA(SNR), NV(SNR), OR(SNR), WA(SNR)"
157009,2-157009,210115,PDLAM1N0J0,Vascular Plant,Dicots,Pycnanthemum virginianum,Standard,Species,B94KAR01HQUS,"Kartesz, J.T. 1994. A synonymized checklist of the vascular flora of the United States, Canada, and Greenland. 2nd edition. 2 vols. Timber Press, Portland, OR.",,Virginia Mountainmint,Pycnanthème de Virginie,,Species,Pycnanthemum virginianum,Virginia Mountain-mint,Pycnanthème de Virginie,,G5,G5,8/29/1984,8/1/2016,N4,N4,4/28/2016,4/28/2016,,,,,,,,,,"NB(S1), ON(S4), QC(S3)","AL(S1), AR(S1S2), CT(SNR), DC(SH), DE(S4), GA(S2), IA(S4), IL(SNR), IN(SNR), KS(S1), KY(S4?), MA(SNR), MD(S2), ME(SNR), MI(SNR), MN(SNR), MO(SNR), MS(SNR), NC(S1?), ND(S3), NE(SNR), NH(S1), NJ(S4), NY(S4), OH(SNR), OK(SNR), PA(SNR), RI(SNR), SD(SNR), TN(SNR), TV(SNR), VA(S4), VT(SNR), WI(SNR), WV(S4)"
138617,2-138617,197940,PDFAG05020,Vascular Plant,Dicots,Quercus alba,Standard,Species,B94KAR01HQUS,"Kartesz, J.T. 1994. A synonymized checklist of the vascular flora of the United States, Canada, and Greenland. 2nd edition. 2 vols. Timber Press, Portland, OR.","Quercus alba regularly hybridizes with other species in the white oak group, some of which have been named (Flora of North America 1997).",White Oak,Chêne blanc,,Species,Quercus alba,White Oak,Chêne blanc,,G5,G5,8/29/1984,12/12/2020,N5,N5,9/6/2002,10/10/2016,,,,,,,,,"<i>Quercus alba</i>, commonly known as White Oak, is a widespread tree occurring throughout much of eastern North America. It occurs in areas that have been impacted by threats such as habitat loss and invasive species. Its durable, high-quality wood was used commercially for building ships and furniture. It is still used today but at a smaller scale. Despite these threats, <i>Quercus alba </i>remains a widespread species at low risk of extinction.","ON(S5), QC(S3)","AL(SNR), AR(SNR), CT(SNR), DC(S3), DE(S5), FL(SNR), GA(SNR), GS(P5), IA(S4), IL(S5), IN(SNR), KS(SNR), KY(S5), LA(SNR), MA(SNR), MD(SNR), ME(S4), MI(SNR), MN(SNR), MO(SNR), MS(SNR), NC(S5), NE(S1), NH(SNR), NJ(S5), NY(S5), OH(SNR), OK(SNR), PA(S5), RI(SNR), SC(SNR), TN(SNR), TX(SNR), VA(S5), VT(SNR), WI(SNR), WV(S5)"
145299,2-145299,219295,PDFAG05060,Vascular Plant,Dicots,Quercus bicolor,Standard,Species,B94KAR01HQUS,"Kartesz, J.T. 1994. A synonymized checklist of the vascular flora of the United States, Canada, and Greenland. 2nd edition. 2 vols. Timber Press, Portland, OR.",,Swamp White Oak,Chêne bicolore,,Species,Quercus bicolor,Swamp White Oak,Chêne bicolore,,G5,G5,8/29/1984,7/28/2016,N4,N4,9/6/2002,9/6/2017,,,,,,,,,,"NS(SNA), ON(S4), QC(S2)","AL(SNR), CT(SNR), DC(SNR), DE(S4), IA(S3), IL(S3S4), IN(SNR), KS(S1), KY(S5), MA(SNR), MD(SNR), ME(S1), MI(SNR), MN(S3), MO(SNR), NC(S2), NE(SNR), NH(SNR), NJ(S4), NY(S5), OH(SNR), PA(S5), RI(SNR), SC(S1), TN(SNR), VA(S4), VT(SNR), WI(SNR), WV(S4)"
147581,2-147581,239442,PDFAG050N0,Vascular Plant,Dicots,Quercus garryana,Standard,Species,B94KAR01HQUS,"Kartesz, J.T. 1994. A synonymized checklist of the vascular flora of the United States, Canada, and Greenland. 2nd edition. 2 vols. Timber Press, Portland, OR.","Kartesz (1999) and Flora North America recognize three varieties of Quercus garryana: variety breweri, variety semota, and the typical.  An unpublished data set from Kartesz 2004 recognizes a variety fruticosa and not a variety breweri.  Flora North America mentions no variety fruticosa.",Oregon White Oak,Chêne d'Oregon;  Chêne de Garry,,Species,Quercus garryana,Garry Oak,Chêne d'Oregon;  Chêne de Garry,,G5,G5,1/16/1990,5/13/2016,N5,N5,4/15/2014,11/17/2017,,,,,,,,,,BC(S5),"CA(SNR), OR(SNR), WA(SNR)"
137659,2-137659,237040,PDFAG050N2,Vascular Plant,Dicots,Quercus garryana var. garryana,Standard,Variety,B94KAR01HQUS,"Kartesz, J.T. 1994. A synonymized checklist of the vascular flora of the United States, Canada, and Greenland. 2nd edition. 2 vols. Timber Press, Portland, OR.","Kartesz (1999) and Flora North America recognize three varieties of Quercus garryana: variety breweri, variety semota, and the typical.  An unpublished data set from Kartesz 2004 recognizes a variety fruticosa and not a variety breweri.  Flora North America mentions no variety fruticosa.",Oregon White Oak,Chêne de Garry,,Variety,Quercus garryana var. garryana,Garry Oak,Chêne de Garry,,G5T5,T5,10/23/2000,6/27/2016,N5,N5,4/15/2014,6/27/2016,,,,,,,,,,BC(S5),"CA(SNR), OR(SNR), WA(SNR)"
158441,2-158441,209160,PDFAG05190,Vascular Plant,Dicots,Quercus macrocarpa,Standard,Species,B94KAR01HQUS,"Kartesz, J.T. 1994. A synonymized checklist of the vascular flora of the United States, Canada, and Greenland. 2nd edition. 2 vols. Timber Press, Portland, OR.","Flora North America does not recognize Q. macrocarpa var. depressa as a distinct variety, while Kartesz (1999) does.",Bur Oak,Chêne à gros fruits,,Species,Quercus macrocarpa,Bur Oak,Chêne à gros fruits,,G5,G5,9/6/1983,5/25/2018,N5,N5,4/15/2014,11/18/2017,,,,,,,,,"<i>Quercus macrocarpa</i> is a wide ranging species in North America, occurring across most of the eastern United States and southern Canada. The number of occurrences and population size can't be quantified with available data, but it is believed to be abundant throughout most of its range. While there are threats to this species in parts of the range, the overall impact is low. Some treatments recognize two varieties (var. <i>depressa</i> and var. <i>macrocarpa</i>). Not enough information is available to assess variety <i>depressa</i> at this times, so individual assessments of varieties are incomplete. Most of the range is attributed to var. <i>macrocarpa</i>.","AB(SU), MB(S5), NB(S2), ON(S5), QC(S4), SK(S5?)","AL(S2), AR(SNR), CT(SU), DC(S1), DE(SNA), IA(S5), IL(S5), IN(SNR), KS(SNR), KY(SNR), LA(S1), MA(S3), MD(S1S2), ME(SNR), MI(SNR), MN(SNR), MO(SNR), MS(S2), MT(S2), NC(SNR), ND(SNR), NE(SNR), NH(S1), NJ(SNR), NM(SNR), NY(S4), OH(SNR), OK(SNR), PA(S2S4), RI(SNR), SD(S5), TN(SNR), TV(SNR), TX(SNR), VA(S1), VT(SNR), WI(SNR), WV(S4), WY(S2S3)"
131052,2-131052,239660,PDFAG053A0,Vascular Plant,Dicots,Quercus muehlenbergii,Standard,Species,B94KAR01HQUS,"Kartesz, J.T. 1994. A synonymized checklist of the vascular flora of the United States, Canada, and Greenland. 2nd edition. 2 vols. Timber Press, Portland, OR.","Name often spelled 'muhlenbergii' in older works; correct spelling is now considered to be 'muehlenbergii' under rules for transliterating umlauts in International Code of Botanical Nomenclature (Berlin). According to Little (Checklist, 1979), original publication of name by Engelmann used a 'u' with an umlaut, which is now transliterated to 'ue' under ICBN. However, Dan Nicolson in e-mail correspondence with Alan Weakley (Oct 2000), citing TL-2, notes that Gotthilf Henry Ernest Muhlenberg (1753-1815) was born in America (although educated in Germany), and used an anglicized spelling, Muhlenberg, adopted by his father, and signed letters without an umlaut. Nevertheless, the form used in the original publication of the name may be uncorrectable in this regard, since the author's intention of a Germanic spelling was clear. (Furthermore, the International Code of Botanical Nomenclature, St. Louis ed. (2000), uses the spelling 'muehlenbergii' in mention of this species in an example (Art. H.10.3, example 5)). Larry Morse, 23Oct00, rev. 14Nov00 & 17Oct01.",Chinquapin Oak,Chêne jaune,"Quercus muhlenbergii, Quercus prinoides var. acuminata",Species,Quercus muehlenbergii,Chinquapin Oak,Chêne jaune,"Quercus muhlenbergii, Quercus prinoides var. acuminata",G5,G5,8/25/1994,6/27/2016,N4,N4,4/15/2014,10/25/2017,,,,,,,,,,ON(S4),"AL(SNR), AR(SNR), CT(S3), DC(SNR), DE(SU), FL(SNR), GA(SNR), GS(P1), IA(S4), IL(S3S4), IN(SNR), KS(SNR), KY(S5), LA(S3), MA(S2), MD(S4), MI(SNR), MN(SH), MO(SNR), MS(SNR), NC(S2), NE(SNR), NJ(S4), NM(S3?), NY(S4), OH(SNR), OK(SNR), PA(SNR), SC(SNR), TN(SNR), TV(SNR), TX(SNR), VA(S5), VT(S3), WI(S1S2), WV(S5)"
159415,2-159415,212184,PDFAG051P0,Vascular Plant,Dicots,Quercus palustris,Standard,Species,B94KAR01HQUS,"Kartesz, J.T. 1994. A synonymized checklist of the vascular flora of the United States, Canada, and Greenland. 2nd edition. 2 vols. Timber Press, Portland, OR.",,Pin Oak,Chêne des marais,,Species,Quercus palustris,Swamp Pin Oak,Chêne des marais,,G5,G5,3/23/1984,6/23/2016,N4,N4,7/14/2009,6/23/2016,,,,,,,,,,ON(S4),"AR(SNR), CT(SNR), DC(SNR), DE(S5), GA(SH), IA(S3), IL(S4S5), IN(SNR), KS(SNR), KY(S5), MA(SNR), MD(SNR), ME(SNA), MI(SNR), MO(SNR), MS(S2?), NC(S2), NE(SNR), NJ(S5), NY(S4), OH(SNR), OK(SNR), PA(S5), RI(SNR), SC(SNR), TN(SNR), TV(SNR), VA(S5), VT(SNA), WI(S1), WV(S5)"
131048,2-131048,239661,PDFAG051S0,Vascular Plant,Dicots,Quercus prinoides,Standard,Species,B94KAR01HQUS,"Kartesz, J.T. 1994. A synonymized checklist of the vascular flora of the United States, Canada, and Greenland. 2nd edition. 2 vols. Timber Press, Portland, OR.","As treated here (following Kartesz 1994 and 1999), excludes Quercus muehlenbergii, sometimes treated within Quercus prinoides as var. acuminata. A different variety (var. rufescens) has sometimes been recognized but is not accepted by Kartesz (1999). LEM 22Nov00.",Dwarf Chinquapin Oak,Chêne nain,"Quercus prinoides var. prinoides, Quercus prinoides var. rufescens",Species,Quercus prinoides,Dwarf Chinquapin Oak,Chêne nain,"Quercus prinoides var. prinoides, Quercus prinoides var. rufescens",G5,G5,2/9/1988,7/28/2016,N2,N2,3/12/1997,9/6/2017,,,,,,,,,,ON(S2),"AL(SNR), AR(SH), CT(SNR), DC(SX), DE(S1), GA(S2), IA(S3), IL(SNR), IN(S1), KS(SNR), LA(SNR), MA(SNR), MD(S4), ME(SNR), MI(SNR), MN(SNR), MO(S3?), NC(S1), NE(S1), NH(SNR), NJ(S3S4), NY(S5), OK(SNR), PA(S5), RI(S2), TN(SNR), TV(SNR), TX(SNR), VA(S1), VT(S1), WI(SNR), WV(S1)"
155953,2-155953,239810,PDFAG051X0,Vascular Plant,Dicots,Quercus rubra,Standard,Species,B94KAR01HQUS,"Kartesz, J.T. 1994. A synonymized checklist of the vascular flora of the United States, Canada, and Greenland. 2nd edition. 2 vols. Timber Press, Portland, OR.","Kartesz (1999) recognizes Quercus rubra var. ambigua as a distinct taxon while Flora North America vol. 3 does not, further still, Flora North America vol. 3 does not even mention this taxon in synonymy or in the species description for Q. rubra.",Northern Red Oak,Chêne rouge,,Species,Quercus rubra,Northern Red Oak,Chêne rouge,,G5,G5,8/29/1984,5/13/2016,N5,N5,4/15/2014,11/18/2017,,,,,,,,,,"NB(S5), NS(S5), ON(S5), PE(S4), QC(S5?)","AL(SNR), AR(SNR), CT(SNR), DC(S4), DE(S5), GA(SNR), GS(P5), IA(SNR), IL(S5), IN(SNR), KS(SNR), KY(SNR), LA(S1S3), MA(SNR), MD(SNR), ME(S5), MI(SNR), MN(SNR), MO(SNR), MS(SNR), NC(S5), NE(SNR), NH(SNR), NJ(SNR), NY(S5), OH(SNR), OK(SNR), PA(S5), RI(SNR), SC(SNR), TN(SNR), VA(S5), VT(SNR), WI(SNR), WV(S5)"
133488,2-133488,216513,PDFAG05290,Vascular Plant,Dicots,Quercus velutina,Standard,Species,B94KAR01HQUS,"Kartesz, J.T. 1994. A synonymized checklist of the vascular flora of the United States, Canada, and Greenland. 2nd edition. 2 vols. Timber Press, Portland, OR.",,Black Oak,Chêne des teinturiers,,Species,Quercus velutina,Black Oak,Chêne des teinturiers,,G5,G5,8/29/1984,7/28/2016,N4,N4,4/15/2014,10/25/2017,,,,,,,,,,ON(S4),"AL(SNR), AR(SNR), CT(SNR), DC(SNR), DE(S5), FL(SNR), GA(SNR), GS(P4), IA(S5), IL(S5), IN(SNR), KS(SNR), KY(S5), LA(SNR), MA(SNR), MD(SNR), ME(SNR), MI(SNR), MN(SNR), MO(SNR), MS(SNR), NC(S5), NE(SNR), NH(SNR), NJ(S5), NY(S5), OH(SNR), OK(SNR), PA(S5), RI(SNR), SC(SNR), TN(SNR), TX(SNR), VA(S5), VT(SNR), WI(SNR), WV(S5)"
155970,2-155970,240799,PDCRA0A170,Vascular Plant,Dicots,Rhodiola rosea,Standard,Species,B94KAR01HQUS,"Kartesz, J.T. 1994. A synonymized checklist of the vascular flora of the United States, Canada, and Greenland. 2nd edition. 2 vols. Timber Press, Portland, OR.",,Roseroot Stonecrop,Orpin rose,Sedum rosea,Species,Rhodiola rosea,Roseroot,Orpin rose,Sedum rosea,G5,G5,5/15/1984,9/29/2015,N5,N5,9/29/2015,11/18/2017,,,,,,,,,,"LB(S4S5), NB(S3), NF(S4S5), NS(S4), NU(SU), QC(S4)","CT(SNR), ME(S3S4), NC(SH), NJ(SNR), NY(S1), OR(SNR), PA(S1), TV(SNR), UT(SNR), VT(S1)"
137473,2-137473,236624,PDERI0M020,Vascular Plant,Dicots,Ledum groenlandicum,Standard,Species,B94KAR01HQUS,"Kartesz, J.T. 1994. A synonymized checklist of the vascular flora of the United States, Canada, and Greenland. 2nd edition. 2 vols. Timber Press, Portland, OR.","Here treated as species distinct from Ledum palustre, following Kartesz (1994 checklist); by some authors, considered a subspecies. These plants have sometimes been considered to belong instead to the genus Rhododendron.",Common Labrador-tea,Thé du Labrador,Rhododendron groenlandicum,Species,Rhododendron groenlandicum,Common Labrador Tea,Thé du Labrador,Ledum groenlandicum,G5,G5,6/7/1984,5/16/2016,N5,N5,2/25/2002,11/18/2017,,,,,,,,,,"AB(S5), BC(S5), LB(S5), MB(S5), NB(S5), NF(S5), NS(S5), NT(SNR), NU(SU), ON(S5), PE(S5), QC(S5?), SK(S5), YT(S5)","AK(SNR), CT(S2), ID(SNR), MA(SNR), ME(SNR), MI(SNR), MN(SNR), ND(SNR), NH(SNR), NJ(S1), NY(S4S5), OH(SH), OR(SNR), PA(S3), SD(SX), VT(SNR), WA(SNR), WI(SNR)"
136920,2-136920,232657,PDERI0M010,Vascular Plant,Dicots,Ledum glandulosum,Standard,Species,B94KAR01HQUS,"Kartesz, J.T. 1994. A synonymized checklist of the vascular flora of the United States, Canada, and Greenland. 2nd edition. 2 vols. Timber Press, Portland, OR.",,Glandular Labrador-tea,Rhododendron glanduleux,"Rhododendron columbianum, Rhododendron neoglandulosum",Species,Rhododendron neoglandulosum,Western Labrador Tea,Rhododendron glanduleux,"Ledum glandulosum, Rhododendron columbianum",G5,G5,1/16/1990,8/27/2016,N5,N5,10/18/2019,10/18/2019,,,,,,,,,,"AB(S3), BC(S5)","CA(SNR), ID(SNR), MT(S4), NV(SNR), OR(SNR), UT(SNR), WA(SNR), WY(S2)"
